{"effects":{"launch":{"binding":"ABSENT","digest":null,"present":false,"status":"ABSENT","verified":false},"launchIntent":{"binding":"ABSENT","digest":null,"present":false,"status":"ABSENT","verified":false},"terminal":{"binding":"ABSENT","digest":null,"present":false,"status":"ABSENT","verified":false}},"fence":{"current":"VERIFIED","lock":"ABSENT","namespace":"UNCHANGED","root":"VERIFIED","writer":"VERIFIED"},"journal":{"activeSuffix":{"ceiling":null,"remaining":null,"used":1},"bytes":{"ceiling":1048576,"remaining":1048448,"used":128},"events":{"ceiling":10000,"remaining":9999,"used":1},"format":"legacy"},"nextProof":null,"outbox":{"binding":"ABSENT","commandDigest":null,"found":false,"lease":{"digest":null,"present":false,"status":"ABSENT"},"state":null,"stepId":null},"request":{"commandDigest":null,"launchTokenDigest":"a2d10775a7a80c423fbb5e32ada0a17ae2ef68090b9434c95376cbb5ab7ef18a","runId":"golden"},"run":{"epochs":{"attempt":0,"authority":0,"barrier":0,"mode":0},"generation":1,"phaseId":"phase","planDigest":"18ac3e7343f016890c510e93f935261169d9e3f565436429830faf0934f4f8e4","revision":1,"runId":"golden","verified":true,"writerFenceDigest":"55cf1725549ddc93e4855595839742334c9a658c145f24c047f2831896768fa0"},"schema":"lunacy-recovery/v1","unknown":{"active":false,"cause":null}}
