{"effects":{"launch":{"binding":"MATCH","digest":"18ac3e7343f016890c510e93f935261169d9e3f565436429830faf0934f4f8e4","present":true,"status":"VALID","verified":true},"launchIntent":{"binding":"MATCH","digest":"18ac3e7343f016890c510e93f935261169d9e3f565436429830faf0934f4f8e4","present":true,"status":"VALID","verified":true},"terminal":{"binding":"MATCH","digest":"18ac3e7343f016890c510e93f935261169d9e3f565436429830faf0934f4f8e4","present":true,"status":"VALID","verified":true}},"fence":{"current":"VERIFIED","lock":"ABSENT","namespace":"UNCHANGED","root":"VERIFIED","writer":"VERIFIED"},"journal":{"activeSuffix":{"ceiling":null,"remaining":null,"used":1},"bytes":{"ceiling":1048576,"remaining":1048448,"used":128},"events":{"ceiling":10000,"remaining":9999,"used":1},"format":"legacy"},"nextProof":null,"outbox":{"binding":"MATCH","commandDigest":"18ac3e7343f016890c510e93f935261169d9e3f565436429830faf0934f4f8e4","found":true,"lease":{"digest":null,"present":false,"status":"ABSENT"},"state":"ACKED","stepId":"step"},"request":{"commandDigest":"18ac3e7343f016890c510e93f935261169d9e3f565436429830faf0934f4f8e4","launchTokenDigest":"3c469e9d6c5875d37a43f353d4f88e61fcf812c66eee3457465a40b0da4153e0","runId":"golden"},"run":{"epochs":{"attempt":0,"authority":0,"barrier":0,"mode":0},"generation":1,"phaseId":"phase","planDigest":"18ac3e7343f016890c510e93f935261169d9e3f565436429830faf0934f4f8e4","revision":1,"runId":"golden","verified":true,"writerFenceDigest":"55cf1725549ddc93e4855595839742334c9a658c145f24c047f2831896768fa0"},"schema":"lunacy-recovery/v1","unknown":{"active":false,"cause":null}}
